{
  "schema_version": "supplemental-validation-manifest/1.0",
  "status": "CAPTURED",
  "experiment_id": "supplemental-validation-v1.4",
  "ruleset_version": "ruleset-v1.4",
  "participant_id": "SV01",
  "labels_locked_before_inference": true,
  "records": [
    {
      "clip_id": "SV01-POS_RAPID_RISE_SWAY-01",
      "participant_id": "SV01",
      "scenario_id": "POS_RAPID_RISE_SWAY",
      "record_role": "TEST",
      "target": "IMMEDIATE_ORANGE",
      "expected_assessment": "ORANGE",
      "label_status": "PREDECLARED",
      "capture_date": "2026-08-28",
      "media_relpath": "视频/新正负样本/正样本A/POS-RS-01.mp4",
      "sha256": "c9343415b41045c6e6118e74919b3b1ab11760c1fb3b22455210fae8306d7915",
      "byte_size": 849395,
      "source_mode": "RECORDED_REPLAY",
      "simulated": true,
      "authorization_record_id": "SV14-AUTH-PRIVATE-001",
      "camera_position_id": "supplemental-fixed-position-01",
      "device_model": "EZVIZ_C6C"
    },
    {
      "clip_id": "SV01-POS_RAPID_RISE_SWAY-02",
      "participant_id": "SV01",
      "scenario_id": "POS_RAPID_RISE_SWAY",
      "record_role": "TEST",
      "target": "IMMEDIATE_ORANGE",
      "expected_assessment": "ORANGE",
      "label_status": "PREDECLARED",
      "capture_date": "2026-08-28",
      "media_relpath": "视频/新正负样本/正样本A/POS-RS-02.mp4",
      "sha256": "90424ac0b704bfbd0038ede71b36db3ff088eee710012eb8893a7454e7e1104c",
      "byte_size": 815818,
      "source_mode": "RECORDED_REPLAY",
      "simulated": true,
      "authorization_record_id": "SV14-AUTH-PRIVATE-001",
      "camera_position_id": "supplemental-fixed-position-01",
      "device_model": "EZVIZ_C6C"
    },
    {
      "clip_id": "SV01-POS_RAPID_RISE_SWAY-03",
      "participant_id": "SV01",
      "scenario_id": "POS_RAPID_RISE_SWAY",
      "record_role": "TEST",
      "target": "IMMEDIATE_ORANGE",
      "expected_assessment": "ORANGE",
      "label_status": "PREDECLARED",
      "capture_date": "2026-08-28",
      "media_relpath": "视频/新正负样本/正样本A/POS-RS-03.mp4",
      "sha256": "f4b6e18fab45ce75d077f4749936a8e32bc45e744a8613370e133d6c549643b4",
      "byte_size": 800780,
      "source_mode": "RECORDED_REPLAY",
      "simulated": true,
      "authorization_record_id": "SV14-AUTH-PRIVATE-001",
      "camera_position_id": "supplemental-fixed-position-01",
      "device_model": "EZVIZ_C6C"
    },
    {
      "clip_id": "SV01-POS_RAPID_RISE_SWAY-04",
      "participant_id": "SV01",
      "scenario_id": "POS_RAPID_RISE_SWAY",
      "record_role": "TEST",
      "target": "IMMEDIATE_ORANGE",
      "expected_assessment": "ORANGE",
      "label_status": "PREDECLARED",
      "capture_date": "2026-08-28",
      "media_relpath": "视频/新正负样本/正样本A/POS-RS-04.mp4",
      "sha256": "f210021f37f50e737e2936207314d2ba4589daf02f8a272cdca81ba15e5929e4",
      "byte_size": 748948,
      "source_mode": "RECORDED_REPLAY",
      "simulated": true,
      "authorization_record_id": "SV14-AUTH-PRIVATE-001",
      "camera_position_id": "supplemental-fixed-position-01",
      "device_model": "EZVIZ_C6C"
    },
    {
      "clip_id": "SV01-POS_SLOW_SMALL_STEP_SWAY-01",
      "participant_id": "SV01",
      "scenario_id": "POS_SLOW_SMALL_STEP_SWAY",
      "record_role": "TEST",
      "target": "GAIT_TREND",
      "expected_assessment": "YELLOW_NO_ORANGE",
      "label_status": "PREDECLARED",
      "capture_date": "2026-08-28",
      "media_relpath": "视频/新正负样本/正样本B/0dfe707659ac6ff78543153d9e8b8052.mp4",
      "sha256": "3c7f555b5e9fab3da629026c37db51c6b0147e847000fbf3ceddbb76a4dc33d5",
      "byte_size": 1068381,
      "source_mode": "RECORDED_REPLAY",
      "simulated": true,
      "authorization_record_id": "SV14-AUTH-PRIVATE-001",
      "camera_position_id": "supplemental-fixed-position-01",
      "device_model": "EZVIZ_C6C"
    },
    {
      "clip_id": "SV01-POS_SLOW_SMALL_STEP_SWAY-02",
      "participant_id": "SV01",
      "scenario_id": "POS_SLOW_SMALL_STEP_SWAY",
      "record_role": "TEST",
      "target": "GAIT_TREND",
      "expected_assessment": "YELLOW_NO_ORANGE",
      "label_status": "PREDECLARED",
      "capture_date": "2026-08-28",
      "media_relpath": "视频/新正负样本/正样本B/77bf8363e918d3a0cec20be9909eb108.mp4",
      "sha256": "e33fb61754552dd7a92081fa93b1a4e6c82418ddf6e19cd76c6d0eecffec734a",
      "byte_size": 1106739,
      "source_mode": "RECORDED_REPLAY",
      "simulated": true,
      "authorization_record_id": "SV14-AUTH-PRIVATE-001",
      "camera_position_id": "supplemental-fixed-position-01",
      "device_model": "EZVIZ_C6C"
    },
    {
      "clip_id": "SV01-POS_SLOW_SMALL_STEP_SWAY-03",
      "participant_id": "SV01",
      "scenario_id": "POS_SLOW_SMALL_STEP_SWAY",
      "record_role": "TEST",
      "target": "GAIT_TREND",
      "expected_assessment": "YELLOW_NO_ORANGE",
      "label_status": "PREDECLARED",
      "capture_date": "2026-08-28",
      "media_relpath": "视频/新正负样本/正样本B/c8ca857c626c0473514f5a26e41122fd.mp4",
      "sha256": "dabc32bafd1d9ce7c367b45f5deb377faf93a0062417a33aaf8bade2ba791eda",
      "byte_size": 991992,
      "source_mode": "RECORDED_REPLAY",
      "simulated": true,
      "authorization_record_id": "SV14-AUTH-PRIVATE-001",
      "camera_position_id": "supplemental-fixed-position-01",
      "device_model": "EZVIZ_C6C"
    },
    {
      "clip_id": "SV01-POS_SLOW_SMALL_STEP_SWAY-04",
      "participant_id": "SV01",
      "scenario_id": "POS_SLOW_SMALL_STEP_SWAY",
      "record_role": "TEST",
      "target": "GAIT_TREND",
      "expected_assessment": "YELLOW_NO_ORANGE",
      "label_status": "PREDECLARED",
      "capture_date": "2026-08-28",
      "media_relpath": "视频/新正负样本/正样本B/fa03b1646fc1dd8ff50029e1e38be0f8.mp4",
      "sha256": "1e85f895963b96fc8aca05ee0291c9c59ab5231424b74d999772f8ef2e04b526",
      "byte_size": 1231195,
      "source_mode": "RECORDED_REPLAY",
      "simulated": true,
      "authorization_record_id": "SV14-AUTH-PRIVATE-001",
      "camera_position_id": "supplemental-fixed-position-01",
      "device_model": "EZVIZ_C6C"
    },
    {
      "clip_id": "SV01-POS_ASYMMETRIC_STEP-01",
      "participant_id": "SV01",
      "scenario_id": "POS_ASYMMETRIC_STEP",
      "record_role": "TEST",
      "target": "GAIT_TREND",
      "expected_assessment": "YELLOW_NO_ORANGE",
      "label_status": "PREDECLARED",
      "capture_date": "2026-08-28",
      "media_relpath": "视频/新正负样本/正样本C/89ad59600192e44e7655802d96e9013b.mp4",
      "sha256": "e19895a94688fc6bc6538e81f95e6e0363f1c959647e582f28aeac86573a9a4b",
      "byte_size": 1292478,
      "source_mode": "RECORDED_REPLAY",
      "simulated": true,
      "authorization_record_id": "SV14-AUTH-PRIVATE-001",
      "camera_position_id": "supplemental-fixed-position-01",
      "device_model": "EZVIZ_C6C"
    },
    {
      "clip_id": "SV01-POS_ASYMMETRIC_STEP-02",
      "participant_id": "SV01",
      "scenario_id": "POS_ASYMMETRIC_STEP",
      "record_role": "TEST",
      "target": "GAIT_TREND",
      "expected_assessment": "YELLOW_NO_ORANGE",
      "label_status": "PREDECLARED",
      "capture_date": "2026-08-28",
      "media_relpath": "视频/新正负样本/正样本C/b1f832ae85ae3e20c51048616ad7d844.mp4",
      "sha256": "94455e0a4cd600c03e831a2167cbc790fec4b84e0eda17ea1ca419dacf0cead6",
      "byte_size": 1197043,
      "source_mode": "RECORDED_REPLAY",
      "simulated": true,
      "authorization_record_id": "SV14-AUTH-PRIVATE-001",
      "camera_position_id": "supplemental-fixed-position-01",
      "device_model": "EZVIZ_C6C"
    },
    {
      "clip_id": "SV01-POS_ASYMMETRIC_STEP-03",
      "participant_id": "SV01",
      "scenario_id": "POS_ASYMMETRIC_STEP",
      "record_role": "TEST",
      "target": "GAIT_TREND",
      "expected_assessment": "YELLOW_NO_ORANGE",
      "label_status": "PREDECLARED",
      "capture_date": "2026-08-28",
      "media_relpath": "视频/新正负样本/正样本C/c743ac4620fedf75ef03a662b598fa31.mp4",
      "sha256": "c1b57bb6992139fcfbe122476bb669070fd20cfe6af669d196ee0a0a42d65808",
      "byte_size": 1431351,
      "source_mode": "RECORDED_REPLAY",
      "simulated": true,
      "authorization_record_id": "SV14-AUTH-PRIVATE-001",
      "camera_position_id": "supplemental-fixed-position-01",
      "device_model": "EZVIZ_C6C"
    },
    {
      "clip_id": "SV01-POS_ASYMMETRIC_STEP-04",
      "participant_id": "SV01",
      "scenario_id": "POS_ASYMMETRIC_STEP",
      "record_role": "TEST",
      "target": "GAIT_TREND",
      "expected_assessment": "YELLOW_NO_ORANGE",
      "label_status": "PREDECLARED",
      "capture_date": "2026-08-28",
      "media_relpath": "视频/新正负样本/正样本C/d928b44b0a49b993e5d1df8a84f75bae.mp4",
      "sha256": "6d270756beaa9265c74e57d559d66933054732709cb9a95de95db91a8bc24c95",
      "byte_size": 1352172,
      "source_mode": "RECORDED_REPLAY",
      "simulated": true,
      "authorization_record_id": "SV14-AUTH-PRIVATE-001",
      "camera_position_id": "supplemental-fixed-position-01",
      "device_model": "EZVIZ_C6C"
    },
    {
      "clip_id": "SV01-NEG_NORMAL_RISE_WALK-01",
      "participant_id": "SV01",
      "scenario_id": "NEG_NORMAL_RISE_WALK",
      "record_role": "TEST",
      "target": "NEGATIVE_CONTROL",
      "expected_assessment": "NO_ORANGE",
      "label_status": "PREDECLARED",
      "capture_date": "2026-08-28",
      "media_relpath": "视频/新正负样本/负样本A/14dff77a673d666ecef21f054b29f749.mp4",
      "sha256": "fb72b540e9a3bf6c2f1293015a916e88c5ede0db5019478299cb61c30d4a4119",
      "byte_size": 1061335,
      "source_mode": "RECORDED_REPLAY",
      "simulated": true,
      "authorization_record_id": "SV14-AUTH-PRIVATE-001",
      "camera_position_id": "supplemental-fixed-position-01",
      "device_model": "EZVIZ_C6C"
    },
    {
      "clip_id": "SV01-NEG_NORMAL_RISE_WALK-02",
      "participant_id": "SV01",
      "scenario_id": "NEG_NORMAL_RISE_WALK",
      "record_role": "TEST",
      "target": "NEGATIVE_CONTROL",
      "expected_assessment": "NO_ORANGE",
      "label_status": "PREDECLARED",
      "capture_date": "2026-08-28",